{
    "$schema": "../config.schema.json",
    "uri": "sub",
    "api_uri": "privapi",
    "provider_id": "",
    "api_token": "",
    "api_admin_ui_auth": [
        "username",
        "password"
    ],
    "panel_alert_cooldown": 3600,
    "domain": "",
    "fallback_domain": "",
    "ping_check_url": "",
    "salt": "",
    "fingerprints": [
        "safari",
        "chrome",
        "edge",
        "firefox"
    ],
    "nodes": {
        "n1": ""
    },
    "bot": {
        "token": "",
        "whitelist": []
    },
    "discord": {
        "token": "",
        "whitelist": []
    },
    "json_template": {
        "dns": {
            "servers": [
                "8.8.8.8",
                {
                    "address": "77.88.8.8",
                    "domains": [
                        "geosite:category-ru"
                    ]
                }
            ],
            "queryStrategy": "UseIPv4"
        },
        "routing": {
            "rules": {},
            "domainStrategy": "AsIs"
        },
        "inbounds": [],
        "outbounds": [],
        "remarks": ""
    },
    "bypass_packages": [],
    "funny_strings": ["fill this please"],
    "publicbot": {
        "token": ""
    },
    "3xui": {
        "local_panel": {
            "name": "x",
            "address": "127.0.0.1",
            "port": "x",
            "uri": "/backend/dashboard",
            "token": "replace-with-admin-scoped-api-token",
            "https": false,
            "whitelist": false,
            "inbounds_list": [],
            "mode": "blacklist",
            "inject_headers": {}
        }
    },
    "sub_name": "your name's VPN",
    "profiles": {
        "profile1": {
            "flag": "🇫🇮",
            "name": ["English", "Russian"],
            "json": {
                "tag": "proxy",
                "protocol": "vless",
                "settings": {},
                "streamSettings": {}
            },
            "description": ["English", "Russian"],
            "whitelist": false,
            "xhttpExtra": {},
            "masterLink": "vless://...",
            "node": "n1",
            "shortProfileDescription": ["English", "Russian"]
        }
    },
    "redis": {
        "url": "redis://127.0.0.1:6379/0"
    }
}
